{
  "$schema": "http://json-schema.org/draft-07/schema#",
  "$id": "https://hexframe.local/schemas/animation.schema.json",
  "type": "object",
  "additionalProperties": false,
  "required": ["name", "loop", "duration", "keyframes"],
  "properties": {
    "name": { "type": "string", "minLength": 1 },
    "loop": { "type": "boolean" },
    "duration": { "type": "integer", "minimum": 1 },
    "note": { "type": "string" },
    "keyframes": {
      "type": "array", "minItems": 1,
      "items": {
        "type": "object", "additionalProperties": false, "required": ["frame", "bones"],
        "properties": {
          "frame": { "type": "integer", "minimum": 0 },
          "bones": {
            "type": "object",
            "additionalProperties": {
              "type": "object", "additionalProperties": false, "minProperties": 1,
              "properties": { "rotation": { "type": "number" }, "x": { "type": "number" }, "y": { "type": "number" } }
            }
          }
        }
      }
    }
  }
}
