{
  "name": "crouch",
  "loop": false,
  "duration": 4,
  "note": "Holds on its last frame. The crouching hurtboxes change the instant the state does, which is a step function; the drawing catches up over four frames and is allowed to.",
  "keyframes": [
    { "frame": 0, "bones": { "pelvis": { "y": 0 }, "torso": { "rotation": 0 }, "leg_upper_l": { "rotation": 6 }, "leg_lower_l": { "rotation": -8 }, "leg_upper_r": { "rotation": -8 }, "leg_lower_r": { "rotation": 6 } } },
    { "frame": 4, "bones": { "pelvis": { "y": -20 }, "torso": { "rotation": 12 }, "head": { "rotation": -8 }, "leg_upper_l": { "rotation": 62 }, "leg_lower_l": { "rotation": -78 }, "leg_upper_r": { "rotation": -54 }, "leg_lower_r": { "rotation": 70 }, "arm_upper_l": { "rotation": -30 }, "arm_lower_l": { "rotation": -50 }, "arm_upper_r": { "rotation": -34 }, "arm_lower_r": { "rotation": -60 } } }
  ]
}
