{
  "name": "jump",
  "loop": false,
  "duration": 30,
  "note": "Tuck at the apex and reach for the ground on the way down. Its 30 frames happen to match the fighter's airtime; nothing enforces that and nothing should.",
  "keyframes": [
    { "frame": 0,  "bones": { "torso": { "rotation": -6 }, "leg_upper_l": { "rotation": -14 }, "leg_lower_l": { "rotation": 20 }, "leg_upper_r": { "rotation": -10 }, "leg_lower_r": { "rotation": 16 }, "arm_upper_l": { "rotation": -70 }, "arm_upper_r": { "rotation": -74 } } },
    { "frame": 12, "bones": { "torso": { "rotation": 8 }, "leg_upper_l": { "rotation": 52 }, "leg_lower_l": { "rotation": -70 }, "leg_upper_r": { "rotation": 40 }, "leg_lower_r": { "rotation": -62 }, "arm_upper_l": { "rotation": -40 }, "arm_lower_l": { "rotation": -60 }, "arm_upper_r": { "rotation": -44 }, "arm_lower_r": { "rotation": -64 } } },
    { "frame": 22, "bones": { "torso": { "rotation": 2 }, "leg_upper_l": { "rotation": 20 }, "leg_lower_l": { "rotation": -30 }, "leg_upper_r": { "rotation": 10 }, "leg_lower_r": { "rotation": -20 } } },
    { "frame": 30, "bones": { "torso": { "rotation": -2 }, "leg_upper_l": { "rotation": -6 }, "leg_lower_l": { "rotation": 8 }, "leg_upper_r": { "rotation": 6 }, "leg_lower_r": { "rotation": -4 }, "arm_upper_l": { "rotation": -20 }, "arm_upper_r": { "rotation": -24 } } }
  ]
}
