{
  "name": "idle",
  "loop": true,
  "duration": 60,
  "note": "A slow breath. Nothing here is read by the simulation; idle has no move at all.",
  "keyframes": [
    { "frame": 0,  "bones": { "torso": { "rotation": 2 }, "head": { "rotation": -2 }, "arm_upper_l": { "rotation": 28 }, "arm_lower_l": { "rotation": 66 }, "arm_upper_r": { "rotation": 40 }, "arm_lower_r": { "rotation": 68 }, "leg_upper_l": { "rotation": 6 }, "leg_lower_l": { "rotation": -8 }, "leg_upper_r": { "rotation": -8 }, "leg_lower_r": { "rotation": 6 } } },
    { "frame": 20, "bones": { "torso": { "rotation": 4 }, "head": { "rotation": -3 }, "pelvis": { "y": -1 }, "arm_upper_l": { "rotation": 31 }, "arm_lower_l": { "rotation": 64 }, "arm_upper_r": { "rotation": 43 }, "arm_lower_r": { "rotation": 66 } } },
    { "frame": 40, "bones": { "torso": { "rotation": 2 }, "head": { "rotation": -2 }, "pelvis": { "y": 0 }, "arm_upper_l": { "rotation": 28 }, "arm_lower_l": { "rotation": 66 }, "arm_upper_r": { "rotation": 40 }, "arm_lower_r": { "rotation": 68 } } },
    { "frame": 60, "bones": { "torso": { "rotation": 2 }, "head": { "rotation": -2 }, "arm_upper_l": { "rotation": 28 }, "arm_lower_l": { "rotation": 66 }, "arm_upper_r": { "rotation": 40 }, "arm_lower_r": { "rotation": 68 }, "leg_upper_l": { "rotation": 6 }, "leg_lower_l": { "rotation": -8 }, "leg_upper_r": { "rotation": -8 }, "leg_lower_r": { "rotation": 6 } } }
  ]
}
