{
  "name": "crouching_light",
  "loop": false,
  "duration": 16,
  "note": "A low poke from the crouch pose. The crouch offsets are baked in here rather than layered on top of crouch.json, because the renderer plays one clip at a time and blending is not a thing 0.1 needs.",
  "keyframes": [
    { "frame": 0,  "bones": { "pelvis": { "y": -20 }, "torso": { "rotation": 12 }, "leg_upper_l": { "rotation": 62 }, "leg_lower_l": { "rotation": -78 }, "leg_upper_r": { "rotation": -54 }, "leg_lower_r": { "rotation": 70 }, "arm_upper_r": { "rotation": -34 }, "arm_lower_r": { "rotation": -60 } } },
    { "frame": 4,  "bones": { "pelvis": { "y": -22 }, "torso": { "rotation": 18 }, "arm_upper_r": { "rotation": 54 }, "arm_lower_r": { "rotation": -16 } } },
    { "frame": 6,  "bones": { "torso": { "rotation": 19 }, "arm_upper_r": { "rotation": 58 }, "arm_lower_r": { "rotation": -12 } } },
    { "frame": 16, "bones": { "pelvis": { "y": -20 }, "torso": { "rotation": 12 }, "arm_upper_r": { "rotation": -34 }, "arm_lower_r": { "rotation": -60 } } }
  ]
}
