{
  "name": "standing_light",
  "loop": false,
  "duration": 20,
  "note": "Twenty frames against a move that lasts eighteen, on purpose. The arm is fully extended across frames 4-5, which is when the hitbox is live, but the two numbers are related only by an animator's judgement — the renderer holds the last keyframe when the move ends first, and NOTHING re-reads this file to decide what the attack does. Re-time it freely.",
  "keyframes": [
    { "frame": 0,  "bones": { "torso": { "rotation": 0 }, "arm_upper_r": { "rotation": -20 }, "arm_lower_r": { "rotation": -46 }, "hand_r": { "rotation": 0 } } },
    { "frame": 3,  "bones": { "torso": { "rotation": -6 }, "arm_upper_r": { "rotation": 20 }, "arm_lower_r": { "rotation": -70 } } },
    { "frame": 4,  "bones": { "torso": { "rotation": 9 }, "head": { "rotation": -3 }, "arm_upper_r": { "rotation": 76 }, "arm_lower_r": { "rotation": -4 }, "hand_r": { "rotation": 0 } } },
    { "frame": 5,  "bones": { "torso": { "rotation": 10 }, "arm_upper_r": { "rotation": 78 }, "arm_lower_r": { "rotation": 0 } } },
    { "frame": 10, "bones": { "torso": { "rotation": 4 }, "arm_upper_r": { "rotation": 34 }, "arm_lower_r": { "rotation": -40 } } },
    { "frame": 20, "bones": { "torso": { "rotation": 0 }, "head": { "rotation": 0 }, "arm_upper_r": { "rotation": -20 }, "arm_lower_r": { "rotation": -46 } } }
  ]
}
