{
  "name": "walk_forward",
  "loop": true,
  "duration": 24,
  "note": "Aggressive distance-phased gait. Each half-cycle follows contact, down, pass, up, contact; foot bones counter-rotate during plants and roll during passing steps.",
  "keyframes": [
    { "frame": 0,  "bones": { "pelvis": { "y": 0, "x": 1 }, "torso": { "rotation": 7 }, "head": { "rotation": -5 }, "leg_upper_l": { "rotation": 30 }, "leg_lower_l": { "rotation": -25 }, "foot_l": { "rotation": -5 }, "leg_upper_r": { "rotation": -28 }, "leg_lower_r": { "rotation": 13 }, "foot_r": { "rotation": 15 }, "arm_upper_l": { "rotation": -32 }, "arm_lower_l": { "rotation": -48 }, "arm_upper_r": { "rotation": -8 }, "arm_lower_r": { "rotation": -56 } } },
    { "frame": 3,  "bones": { "pelvis": { "y": -2, "x": 2 }, "torso": { "rotation": 8 }, "leg_upper_l": { "rotation": 22 }, "leg_lower_l": { "rotation": -20 }, "foot_l": { "rotation": -2 }, "leg_upper_r": { "rotation": -14 }, "leg_lower_r": { "rotation": 6 }, "foot_r": { "rotation": 8 } } },
    { "frame": 6,  "bones": { "pelvis": { "y": 1, "x": 3 }, "leg_upper_l": { "rotation": 5 }, "leg_lower_l": { "rotation": -8 }, "foot_l": { "rotation": 3 }, "leg_upper_r": { "rotation": 8 }, "leg_lower_r": { "rotation": -32 }, "foot_r": { "rotation": 24 }, "arm_upper_l": { "rotation": -24 }, "arm_upper_r": { "rotation": -16 } } },
    { "frame": 9,  "bones": { "pelvis": { "y": 3, "x": 2 }, "leg_upper_l": { "rotation": -12 }, "leg_lower_l": { "rotation": 4 }, "foot_l": { "rotation": 8 }, "leg_upper_r": { "rotation": 25 }, "leg_lower_r": { "rotation": -38 }, "foot_r": { "rotation": 18 } } },
    { "frame": 12, "bones": { "pelvis": { "y": 0, "x": 1 }, "torso": { "rotation": 7 }, "head": { "rotation": -5 }, "leg_upper_l": { "rotation": -28 }, "leg_lower_l": { "rotation": 13 }, "foot_l": { "rotation": 15 }, "leg_upper_r": { "rotation": 30 }, "leg_lower_r": { "rotation": -25 }, "foot_r": { "rotation": -5 }, "arm_upper_l": { "rotation": -8 }, "arm_lower_l": { "rotation": -56 }, "arm_upper_r": { "rotation": -32 }, "arm_lower_r": { "rotation": -48 } } },
    { "frame": 15, "bones": { "pelvis": { "y": -2, "x": 2 }, "torso": { "rotation": 8 }, "leg_upper_l": { "rotation": -14 }, "leg_lower_l": { "rotation": 6 }, "foot_l": { "rotation": 8 }, "leg_upper_r": { "rotation": 22 }, "leg_lower_r": { "rotation": -20 }, "foot_r": { "rotation": -2 } } },
    { "frame": 18, "bones": { "pelvis": { "y": 1, "x": 3 }, "leg_upper_l": { "rotation": 8 }, "leg_lower_l": { "rotation": -32 }, "foot_l": { "rotation": 24 }, "leg_upper_r": { "rotation": 5 }, "leg_lower_r": { "rotation": -8 }, "foot_r": { "rotation": 3 }, "arm_upper_l": { "rotation": -16 }, "arm_upper_r": { "rotation": -24 } } },
    { "frame": 21, "bones": { "pelvis": { "y": 3, "x": 2 }, "leg_upper_l": { "rotation": 25 }, "leg_lower_l": { "rotation": -38 }, "foot_l": { "rotation": 18 }, "leg_upper_r": { "rotation": -12 }, "leg_lower_r": { "rotation": 4 }, "foot_r": { "rotation": 8 } } },
    { "frame": 24, "bones": { "pelvis": { "y": 0, "x": 1 }, "torso": { "rotation": 7 }, "head": { "rotation": -5 }, "leg_upper_l": { "rotation": 30 }, "leg_lower_l": { "rotation": -25 }, "foot_l": { "rotation": -5 }, "leg_upper_r": { "rotation": -28 }, "leg_lower_r": { "rotation": 13 }, "foot_r": { "rotation": 15 }, "arm_upper_l": { "rotation": -32 }, "arm_lower_l": { "rotation": -48 }, "arm_upper_r": { "rotation": -8 }, "arm_lower_r": { "rotation": -56 } } }
  ]
}
